Question, Option 1, Option 2, Option 3, Option 4, Option 5, Option 6,Correct Answer,Overall Explanation
Which of the following sequence of documents represents a standard order-to-cash process in SAP S/4HANA?,A. Inquiry → Quotation → Billing document → Sales order → Outbound delivery,B. Quotation → Inquiry → Sales order → Outbound delivery,C. Inquiry → Quotation → Sales order → Outbound delivery,D. Sales order → Post goods issue → Outbound delivery → Billing document,,,C,
Which of the following are key features of the SAP Fiori factsheet app Sales Quotations? (There are two correct answers.),A. Display schedule lines details for each of the items,B. Navigate to the Customer – 360° View app,C. Display relevant key facts of the preceding inquiry,D. Display relevant key facts of the quotation,,,BD,
Which of the following statements are correct regarding alternative items in sales?,A. Alternative items can only be used in inquiries.,B. Alternative items can only be used in quotations.,C. Alternative items can only be used in sales orders.,D. Alternative items can be used in both inquiries and quotations.,,,D,
In a sales order with three items (items 10, 20, and 30), payment terms CP00 have been copied from the customer master into the order header, as well as into all three items in the order. The user manually changes the payment terms for item 20 to R001 and saves the order. What would happen if another user subsequently changes the payment terms at the header level to TCPT?,A. The payment terms are updated to TCPT on all items.,B. The payment terms are updated to TCPT on items 10 and 30 only.,C. The payment terms are updated to TCPT on item 20 only.,D. The payment terms are changed at the header level, but none of the items are updated.,,,B,
Which of the following data is proposed from the business partner master record of the ship-to party during sales order creation? (There are three correct answers.),A. Incoterms,B. Tax,C. Shipping conditions,D. Ship-to address,E. Delivering plant,,BDE,
Which of the following data is proposed from the business partner master record of the sold-to party during sales order creation? (There are two correct answers.),A. Delivering plant,B. Incoterms,C. Order reason,D. Shipping conditions,,,BD,
Which master record has priority in terms of delivering plant determination in a sales order item?,A. Material master record,B. Business partner master record (sold-to),C. Business partner master record (ship-to),D. Customer-material information record,,,D,
Which of the following fields are used during automatic shipping point determination in a sales order item? (There are three correct answers.),A. Shipping type,B. Delivery priority,C. Shipping condition,D. Loading group,E. Plant,,CDE,
Which of the following elements can influence the route determination for a sales document item? (There are two correct answers.),A. Material freight group,B. Shipping conditions,C. Unloading point,D. Transportation group,,,BD,
True or False: If a rejection reason is selected for a sales document item, the reference status of the item is automatically set to Fully Referenced, and the item cannot be copied.,A. True,B. False Correct Answer:B Explanation: False. Indeed, a rejected item cannot be copied, but the reference status of the item is not controlled by the rejection reason. The reference status is automatically set when the entire quantity has been copied or based on the completion rule defined for the item category. Question In the standard system, a quotation has been created for 5 units with reference to an inquiry. The total quantity in the inquiry item is 30, and no other subsequent documents exist. Which is the correct reference status value for the inquiry item? A. Fully Referenced B. Not Referenced,C. Partially Referenced,D. Open,,,A,
True or False: In the standard cash sales process, both a delivery and a billing document are automatically generated when the sales order is posted, and a cash invoice is printed immediately from the billing document.,A. True,B. False Correct Answer:B Explanation: False. In the standard cash sales process shown earlier in Figure 9.9, an outbound delivery is automatically generated when the sales order is posted. The billing document is created later, usually via a periodic batch job. Also, the cash sale invoice is an output generated from the sales order, not from the billing document. Question Which of the following are characteristics of a rush order transaction? (There are two correct answers.) A. The customer orders, picks up, and pays for the goods immediately. B. The system automatically creates a delivery when the order is saved.,C. A customer invoice is automatically printed when the order is saved.,D. The goods are picked up by the customer or delivered to the customer the same day the order is placed. Payment takes place later.,,,BD,
Which of the following statements describe the make-to-order sales process in SAP S/4HANA? (There are two correct answers.),A. You must use special item categories for controlling make-to-order production.,B. Produced materials are received into consignment stock.,C. The plant must be populated on the sales order item.,D. The transfer of requirements to production planning is controlled by the strategy group in the material master record.,,,CD,
In a third-party order process, what customizing setting in SAP S/4HANA Sales controls whether the invoice receipt quantity or the quantity of goods received is relevant for billing?,A. The copy control sales document to billing document at the schedule line level,B. The copy control sales document to billing document at the item level,C. The copy control delivery document to billing document at the item level,D. The definition of the sales document item category,,,B,
Which of the following documents used in complaints processing must be created with reference to an invoice?,A. Returns order,B. Free-of-charge subsequent delivery,C. Credit memo request,D. Invoice correction request,,,D,
True or False: Although it is not recommended by SAP, you can create independent free-of-charge subsequent deliveries using standard sales document type SD.,A. True,B. False Correct Answer:B Explanation: False. Standard sales document type SD (free-of-charge subsequent delivery) has been defined with value C in the Reference mandatory field, meaning any free-of-charge subsequent delivery can only be created with reference to a sales order. An example of a free-of-charge subsequent delivery created with reference to a returns order is represented in the diagram shown earlier in Figure 9.17. Question Which of the following ways of creating outbound deliveries are supported in SAP S/4HANA? (There are three correct answers.) A. Without any reference B. With reference to a billing document,C. With reference to a sales order,D. With reference to a stock transport order,E. With reference to a shipment document,,ACD,
True or False: Unlike a sales order, an outbound delivery does not contain any data at the schedule line level.,A. True,B. False Correct Answer:A Explanation: True. The structure of the delivery is divided into data at the header level and at the item level. No schedule lines exist in the delivery. However, schedule line information is available in the sales order and is used to create the delivery document. Question Which of the following fields are only found in the header of the delivery document? (There are two correct answers.) A. Plant B. Shipping point,C. Ship-to party number,D. Reference document number,,,BC,
You must ensure that an outbound delivery will determine a picking storage location. What controls this functionality?,A. The delivery schedule line category,B. The delivery type,C. The delivery item category,D. The material master record,,,C,
Which of the following settings can be configured in the definition of a delivery item category? (There are two correct answers.),A. Whether the delivery item must meet the minimum quantity maintained in the material master or customermaterial record,B. Whether the item is relevant for billing,C. Whether an availability check must be carried out for the item,D. Whether partial deliveries are allowed,,,AC,
Which of the following elements can be used to influence the determination of the delivery item category? (There are three correct answers.),A. Shipping point,B. Item usage,C. Item category group,D. Route,E. Delivery type,,BCE,
Which of the following functions are controlled by the delivery type? (There are two correct answers.),A. The delivery is relevant for picking.,B. A credit limit check must be performed.,C. A sales order is required as a basis for delivery.,D. The rule for determining the storage location for picking.,,,CD,
True or False: Item category determination is not carried out if the outbound delivery is created with reference to a sales order.,A. True,B. False Correct Answer:A Explanation: True. When an outbound delivery is created with reference to a sales order, the item category in the sales order item is automatically copied into the corresponding delivery item. No item category determination is carried out for the delivery item in this scenario. Question A customer requests that two orders be combined into a single delivery. Which of the following sales order fields must have the same value to fulfill the criteria for order combination? (There are three correct answers.) A. Storage location B. Route,C. Incoterms,D. Ship-to party,E. Division,,BCD,
True or False: If needed, you can manually override both the route and/or the shipping point determined by the system in the delivery.,A. True,B. False Correct Answer:B Explanation: False. In a delivery document, you can manually override the route but not the shipping point. The shipping point is not an editable field in any delivery document. Question Which of the following are characteristics of the route determination functionality in SAP S/4HANA? (There are three correct answers.) A. The system prompts you to redetermine the route for each item if the ship-to party changes in the order. B. The system prompts you to redetermine the route for each item if the shipping condition changes in the order.,C. The system prompts you to redetermine the route for the item if the quantity changes in the order.,D. The delivery item category controls whether the route must be redetermined when an outbound delivery is created.,E. Route determination can be carried out with or without weight group.,,ABE,
Which of the following factors is a prerequisite for the automatic determination of the picking location in the delivery item? (There are two correct answers.),A. A picking rule has been assigned to the delivery type.,B. The automatic determination of storage location has been activated for the delivery type.,C. The delivery item category must be relevant for picking.,D. The storage location has been assigned to a warehouse number.,,,AC,
Which of the following elements can be used to determine the loading time in delivery scheduling? (There are three correct answers.),A. Transportation group,B. Route,C. Weight group,D. Loading group,E. Shipping point,,BDE,
During backward scheduling, which of the following times are always determined using the route? (There are two correct answers.),A. Transit time,B. Total replenishment lead time,C. Loading time,D. Transportation lead time,,,AD,
Which of the following functions are carried out on the basis of the goods issue document? (There are two correct answers.),A. Overall status for picking is updated.,B. The document flow is updated.,C. The warehouse or plant stock is increased by the delivery quantity.,D. Delivery requirements in materials planning are reduced by the delivery quantity,,,BD,
Which of the following are characteristics of the billing document in SAP S/4HANA? (There are two correct answers.),A. It contains data at the item level.,B. It contains data at the schedule line level.,C. It can be created without reference to a preceding document.,D. The billing date is only found in the document’s header.,,,AD,
True or False. You cannot assign an external number range to a billing document.,A. True,B. False Correct Answer:A Explanation: True. As shown earlier in Figure 11.3, you can only define an internal number range for billing documents. External number ranges are not allowed to ensure the billing document numbers are unique and consecutive. Question Which of the following customizing activities for billing documents are available in the IMG menu? (There are three correct answers.) A. Define billing item categories B. Define billing types,C. Define item category determination in billing documents,D. Assign invoice list type to each billing type,E. Maintain copying control for billing documents,,BDE,
Which of the following parameters are available when configuring billing document types in SAP S/4HANA? (There are three correct answers.),A. Transaction group,B. Incompleteness procedure,C. Billing type for cancellation,D. Posting block,E. Billing block,,ACD,
True or False. At the time of billing document creation, the billing type is always defaulted based on the billing type associated with a specific sales document type and cannot be manually changed.,A. True,B. False Correct Answer:B Explanation: False. The system automatically proposes a billing type based on the default billing type assigned to the reference document. However, if needed, you can manually change the proposed billing type to another valid billing type. The billing document types allowed are defined in the copy control from sales documents and delivery documents to billing documents. For example, for a given delivery document type LF, you can create a customer invoice (billing type F2) or a pro forma invoice (billing type F8). Question Which of the following are valid document flows when creating a billing document? (There are two correct answers.) A. Invoice → Delivery → Debit memo B. Credit memo request → Credit memo → Invoice,C. Order → Invoice → Credit memo,D. Delivery → Invoice,,,CD,
Which of the following are characteristics of the SAP GUI Transaction VF04 or the equivalent SAP Fiori app Create Billing Documents – VF04? (There are two correct answers.),A. You can display a detailed log for the collective run.,B. You can process the billing due list as a simulation “trial run.”,C. You can switch on/off the billing setting Automatically post billing documents.,D. It is not possible to perform a split analysis.,,,AB,
In terms of billing split or convergence, which of the following variables can influence the outcome of a collective billing run when processing multiple billable reference documents? (There are two correct answers.),A. Discrepancies in split-relevant fields at the header or item level,B. A custom pricing requirement assigned to condition PPR0,C. The billing setting Automatically post billing documents in the Create Billing Documents app,D. A custom data transfer routine in the copying control for billing documents,,,AD,
True or False: During collective billing, different customer reference numbers (field VBKD-BSTKD) in two sales orders always cause a billing document split, despite all the other splitrelevant fields having identical values.,A. True,B. False Correct Answer:B Explanation: False. As mentioned in this chapter, the customer reference number is stored in field VBKD-BSTKD in the sales document and field VBRK-BSTNK_VF in the billing document. This field constitutes a special case and does not always cause a billing document split, which is the reason why it has not been included in the list of fields that form the standard split criteria shown earlier in Table 11.5. The customer reference number will cause a billing document split only if you maintain the Reference Number parameter with value A in the copy control for billing documents at the header level. But if the Reference Number parameter is blank in the copy control for billing documents, you can combine two sales documents with two different customer reference numbers (field VBKD-BSTKD) in one billing document since the field VBRK-BSTNK_VF will be blank. Question Which standard fields always cause a billing document split when populated with differing values? (There are two correct answers.) A. Distribution channel B. Bill-to party,C. Total net value,D. Ship-to party,,,AB,
Which of the following statements regarding preliminary billing documents are true? (There are three correct answers.),A. They can be changed as often as necessary.,B. To use them, you need to activate the corresponding business function in customizing.,C. They are available from SAP S/4HANA 1909.,D. They can be posted to financial accounting.,E. A preliminary billing document is an optional predecessor to the final billing document.,,ABE,
You’ve been asked to set up the system so that invoices are created based on the completion of specific stages of a project. Which functionality supports this business requirement?,A. Preliminary billing documents,B. Milestone billing plans,C. Periodic billing plans,D. Invoice lists,,,B,
True or False. SAP S/4HANA allows you to process down payments on the basis of either periodic or milestone billing plans in sales orders.,A. True,B. False Correct Answer:B Explanation: False. In SAP S/4HANA, down payments can only be processed on the basis of either milestone billing plans or document conditions in sales orders. You cannot process down payments with periodic billing plans. Question Which of the following are characteristics of an invoice list in the standard system? (There are two correct answers.) A. It can contain single or collective billing documents. B. A single invoice list can contain invoices, credit memos, and debit memos.,C. It only contains billing documents with a common bill-to party.,D. It only contains billing documents that have already been released to financial accounting.,,,AD,
Which of the following parameters are used by the system to perform account determination when a billing document is transferred to financial accounting? (There are three correct answers.),A. Account assignment group of the ship-to party,B. Account key,C. Sales organization,D. Profit center in the material master record,E. Account assignment group of the material,,BCE,
Which of the following is the purpose of the simplification list?,A. To show a list of transactions that are no longer used,B. To show a list of tasks needed for conversion from SAP ERP 6.0 to SAP S/4HANA,C. To show a list of technical and business impacts that can be expected with an upgrade to that specific version of SAP S/4HANA,D. To run a consistency check to run against your existing system to see what needs to change before upgrading to SAP S/4HANA.,,,C,
Which of the following are simplification items that should be considered when moving to an SAP S/4HANA environment from an SAP ERP 6.0 environment? (There are three correct answers.),A. The SAP ERP SD foreign trade functionality has now been absorbed into the Materials Management (MM) module.,B. SD rebates have been replaced by settlement management.,C. Output management in SAP S/4HANA Sales is performed, by default, via BRFplus instead of the previous NAST-based approach.,D. The ATP check has been enriched in SAP S/4HANA to include SAP S/4HANA for advanced ATP capabilities.,E. The standard sales tables VBAK and VBAP do not need to be used anymore in SAP S/4HANA.,,BCD,
Your client asks you why they should implement business partners in their SAP S/4HANA project. Which of the following statements would you mention? (There are three correct answers.),A. Business partners are mandatory in SAP S/4HANA, and customers can no longer be created in transactions such as Transaction XD01.,B. The business partner approach means we no longer need to think about partner functions such as sold-to party, ship-to party, bill-to party, and payer.,C. The unified architecture of business partners means one data object can serve multiple roles.,D. The business partner approach means that SAP S/4HANA conforms to the same architecture as other SAP products in the landscape.,E. Every SAP user in the system has their own business partner record, thus improving transparency and visibility.,,ACD,
Which of the following statements is true about traditional customer master transactions, such as Transactions XD01 and VD01, in SAP S/4HANA:,A. Attempting to use the transactions will redirect you to Transaction BP.,B. Transactions are still available but are not recommended for use.,C. Transactions have disappeared entirely and will not be recognized if used. Correct Answer:A Explanation: Obsolete transactions related to customer and vendor master records will now redirect you to the unified Transaction BP via a dialog message. As such, the transactions still exist, but only as a pointer to the correct transaction. Question The CVI functionality can be used to perform which of the following activities? A. Set up the system so that all business partner data is stored in the BUT* tables without the need to copy to tables KNA1 and KNVV B. Ensure that, once business partners are created, the data is filtered down to the customer and vendor tables C. Set up a connection between customers and vendors so that any data added to the vendor master data object can be selectively copied to the customer master data object Correct Answer:B Explanation: CVI exists so that there is a permanent link between a business partner and the customer or vendor tables, such as tables KNA1 and LFA1. Once the SAP S/4HANA system is established, business partner data is saved in the BUT* tables, but if the business partner is extended to the role “customer” then the data will be copied to all the customer master tables, such as tables KNA1 and KNVV. Question When converting from SAP ERP 6.0 to SAP S/4HANA, several steps are required in order to convert customers and vendors to business partners. Which of the following steps are required? (There are two correct answers.) A. Implement CVI in your SAP ERP 6.0 system B. Stop all users from creating customers using Transaction XD01 in your SAP ERP 6.0 system using security authorizations C. Convert existing customers and vendors to business partners in your SAP ERP 6.0 system,D. Create a Legacy System Migration Workbench (LSMW) migration script to convert the customers and vendors in your SAP ERP 6.0 system to business partners in your SAP S/4HANA system,,,AC,
Settlement management in SAP S/4HANA replaces SD rebates. What does this mean for the sales data model?,A. The SD rebate type field has been extended from 1 character to 3 characters.,B. Table VBOX is now redundant.,C. Table VBOX can still be used but must be manually activated. Correct Answer:B Explanation: Within the SD rebates functionality, table VBOX was a real problem for performance, with hundreds of thousands (and in many cases, millions) of data records housed in the table. Due to the power of the SAP HANA database, such index tables are no longer required, and table VBOX is therefore completely redundant in SAP S/4HANA. Question The BRFplus approach to outputs does come with a few limitations. Which of these limitations are true? (There are two correct answers.) A. Only business partners can be used for communication purposes. B. IDocs cannot be used at all by BRFplus. C. ALE is not supported by BRFplus.,D. BRFplus is only available for sales outputs, and therefore, outputs for POs cannot be used.,,,AC,
True or False: The BRFplus approach to SD output management is mandatory in SAP S/4HANA.,A. True,B. False Correct Answer:B Explanation: False. While it is true that the BRFplus approach to sales and distribution outputs is the default approach in SAP S/4HANA, this functionality can be switched off, meaning that sales and distribution outputs can revert back to the NAST methodology. Question Which of the following are the attributes of BRFplus decision tables? (There are two correct answers.) A. Multiple condition columns are allowed but only one result column. B. Rows in the decision table are read sequentially from top to bottom.,C. When setting up the decision table, each step must be activated before it can be used.,D. Master data value updates in the decision tables in BRFplus must always be transported through the development system to the production landscape.,,,BC,
Which of the following attributes are true for the SAP S/4HANA credit management approach to customer credit limits? (There are three correct answers.),A. Credit limits can be calculated using a predefined and customizable formula.,B. Credit limits for customers are maintained using Transaction FD32.,C. Customer credit limits can be calculated dynamically or set as a static value.,D. Customer credit limits can be activated by sales document type and/or by item category.,E. By default, customer credit limits are set by the integration with the Credit Rules Engine.,,ACD,
